"UM5AK4RD","journalArticle","2021","Bamouh, Zahra; Fellahi, Siham; Khayi, Slimane; Hamdi, Jihane; Tadlaoui, Khalid Omari; Fassi-Fihri, Ouafaa; Elharrak, M","Draft Genome Sequence of the Capripoxvirus KSGP 0240 vaccine Strain reisolated from cattle","","","","","","","2021","2021-07-12 13:03:10","2021-07-12 15:08:37","","4","","","","","Microbiol Resour Announc","","","","","","","","en","","","","","Zotero","","","","C:\Users\workstation_bioinfo\Desktop\Downloads\MRA00440-21R3-Manuscript_Text_File.pdf","","","","","","","","","","","","","","","","","","","","","","","","","","","","","","","","","","","","","","","","","","","","","","","","",""
"3AXEDNQL","journalArticle","2021","Bkiri, Dounia; Fellahi, Siham; Khayi, Slimane; Omari Tadlaoui, Khalid; Fassi Fihri, Ouafaa; El Harrak, Mehdi","Genome Sequence of <i>Mannheimia haemolytica</i> MHA.Sh.MOR19 Serotype 1, a Moroccan Sheep Isolate","Microbiology Resource Announcements","","2576-098X","10.1128/MRA.00359-21","https://journals.asm.org/doi/10.1128/MRA.00359-21","Mannheimia haemolytica               is the principle bacterial pathogen in ruminants associated with respiratory disease. Here, we report the draft genome sequence of the               Mannheimia haemolytica               MHA.Sh.MOR19 strain that was recently isolated in the northwest of Morocco from the lung of a lamb with pneumonia that died. The genome size is 2,434,458 bp.                        ,              ABSTRACT                            Mannheimia haemolytica               is the principle bacterial pathogen in ruminants associated with respiratory disease. Here, we report the draft genome sequence of the               Mannheimia haemolytica               MHA.Sh.MOR19 strain that was recently isolated in the northwest of Morocco from the lung of a lamb that died from pneumonia. The genome size is 2,434,458 bp.","2021-05-27","2021-07-12 15:04:34","2021-07-12 15:04:34","2021-07-12 15:04:34","","","21","10","","Microbiol Resour Announc","","","","","","","","en","","","","","DOI.org (Crossref)","","","","C:\Users\workstation_bioinfo\Zotero\storage\GHYFNNQN\Bkiri et al. - 2021 - Genome Sequence of Mannheimia haemolytica M.pdf","","","","Putonti, Catherine","","","","","","","","","","","","","","","","","","","","","","","","","","","","","","","","","","","","","","","","","","","","",""
"VNHPVUZS","journalArticle","2021","Oulghazi, Said; Sarfraz, Sohaib; Zaczek-Moczydłowska, Maja A.; Khayi, Slimane; Ed-Dra, Abdelaziz; Lekbach, Yassir; Campbell, Katrina; Novungayo Moleleki, Lucy; O’Hanlon, Richard; Faure, Denis","Pectobacterium brasiliense: Genomics, Host Range and Disease Management","Microorganisms","","2076-2607","10.3390/microorganisms9010106","https://www.mdpi.com/2076-2607/9/1/106","Pectobacterium brasiliense (Pbr) is considered as one of the most virulent species among the Pectobacteriaceae. This species has a broad host range within horticulture crops and is well distributed elsewhere. It has been found to be pathogenic not only in the field causing blackleg and soft rot of potato, but it is also transmitted via storage causing soft rot of other vegetables. Genomic analysis and other cost-effective molecular detection methods such as a quantitative polymerase chain reaction (qPCR) are essential to investigate the ecology and pathogenesis of the Pbr. The lack of fast, field deployable point-of-care testing (POCT) methods, specific control strategies and current limited genomic knowledge make management of this species difficult. Thus far, no comprehensive review exists about Pbr, however there is an intense need to research the biology, detection, pathogenicity and management of Pbr, not only because of its fast distribution across Europe and other countries but also due to its increased survival to various climatic conditions. This review outlines the information available in peer-reviewed literature regarding host range, detection methods, genomics, geographical distribution, nomenclature and taxonomical evolution along with some of the possible management and control strategies. In summary, the conclusions and a further directions highlight the management of this species.","2021-01-05","2021-07-12 15:07:34","2021-07-12 15:07:34","2021-07-12 15:07:34","106","","1","9","","Microorganisms","Pectobacterium brasiliense","","","","","","","en","","","","","DOI.org (Crossref)","","","","C:\Users\workstation_bioinfo\Zotero\storage\U9V8SJKP\Oulghazi et al. - 2021 - Pectobacterium brasiliense Genomics, Host Range a.pdf","","","","","","","","","","","","","","","","","","","","","","","","","","","","","","","","","","","","","","","","","","","","","","","","",""
"ENIYLGDE","journalArticle","2020","Khayi, Slimane; Azza, Nour Elhouda; Gaboun, Fatima; Pirro, Stacy; Badad, Oussama; Claros, M. Gonzalo; Lightfoot, David A.; Unver, Turgay; Chaouni, Bouchra; Merrouch, Redouane; Rahim, Bouchra; Essayeh, Soumaya; Ganoudi, Matika; Abdelwahd, Rabha; Diria, Ghizlane; Mdarhi, Meriem Alaoui; Labhilili, Mustapha; Iraqi, Driss; Mouhaddab, Jamila; Sedrati, Hayat; Memari, Majid; Hamamouch, Noureddine; Alché, Juan de Dios; Boukhatem, Noureddine; Mrabet, Rachid; Dahan, Rachid; Legssyer, Adelkhaleq; Khalfaoui, Mohamed; Badraoui, Mohamed; Van de Peer, Yves; Tatusova, Tatiana; El Mousadik, Abdelhamid; Mentag, Rachid; Ghazal, Hassan","First draft genome assembly of the Argane tree (Argania spinosa)","F1000Research","","2046-1402","10.12688/f1000research.15719.2","https://f1000research.com/articles/7-1310/v2","Background:               The Argane tree (               Argania spinosa               L. Skeels) is an endemic tree of mid-western Morocco that plays an important socioeconomic and ecologic role for a dense human population in an arid zone. Several studies confirmed the importance of this species as a food and feed source and as a resource for both pharmaceutical and cosmetic compounds. Unfortunately, the argane tree ecosystem is facing significant threats from environmental changes (global warming, over-population) and over-exploitation. Limited research has been conducted, however, on argane tree genetics and genomics, which hinders its conservation and genetic improvement.                                         Methods:               Here, we present a draft genome assembly of               A. spinosa               . A reliable reference genome of                A. spinosa                was created using a hybrid                de novo               assembly approach combining short and long sequencing reads.                                         Results:               In total, 144 Gb Illumina HiSeq reads and 7.6 Gb PacBio reads were produced and assembled. The final draft genome comprises 75 327 scaffolds totaling 671 Mb with an N50 of 49 916 kb. The draft assembly is close to the genome size estimated by               k               -mers distribution and covers 89% of complete and 4.3 % of partial               Arabidopsis               orthologous groups in BUSCO.                                         Conclusion:               The               A. spinosa               genome will be useful for assessing biodiversity leading to efficient conservation of this endangered endemic tree. Furthermore, the genome may enable genome-assisted cultivar breeding, and provide a better understanding of important metabolic pathways and their underlying genes for both cosmetic and pharmacological.","2020-05-04","2021-07-28 12:00:48","2021-07-28 12:00:48","2021-07-28 12:00:48","1310","","","7","","F1000Res","","","","","","","","en","","","","","DOI.org (Crossref)","","","","C:\Users\workstation_bioinfo\Zotero\storage\A57NZJQC\Khayi et al. - 2020 - First draft genome assembly of the Argane tree (Ar.pdf","","","","","","","","","","","","","","","","","","","","","","","","","","","","","","","","","","","","","","","","","","","","","","","","",""
"XPNSTNNW","bookSection","2021","Ghazal, Hassan; Badad, Oussama; Zaid, Houcine; Tatusova, Tatiana; Pirro, Stacy; Khayi, Slimane; Gaboun, Fatima; Aberkani, Kamal; El Finti, Aissam; Kinsel, Mary; Zahidi, Abdelaziz; Ait Aabd, Naima; Mouhaddab, Jamila; Msanda, Fouad; Idrissi Azami, Abdellah; Mentag, Rachid; El Mousadik, Abdelhamid","Argane Genetics and Genomics","Oil Crop Genomics","978-3-030-70419-3 978-3-030-70420-9","","","https://link.springer.com/10.1007/978-3-030-70420-9_7","","2021","2021-09-27 10:12:24","2021-09-27 10:12:24","2021-09-27 10:12:24","123-134","","","","","","","","","","","Springer International Publishing","Cham","en","","","","","DOI.org (Crossref)","","DOI: 10.1007/978-3-030-70420-9_7","","F:\Bibioigraphy_zotero\Ghazal et al 2021_Chapter_ArganeGeneticsAndGenomics_Book Spriner Oil Crop Genomics.pdf","","","","Tombuloglu, Huseyin; Unver, Turgay; Tombuloglu, Guzin; Hakeem, Khalid Rehman","","","","","","","","","","","","","","","","","","","","","","","","","","","","","","","","","","","","","","","","","","","","",""
"9CXJDRM3","journalArticle","2021","Khayi, Slimane; Armitage, Andrew D.; El Guilli, Mohammed; Meftah Kadmiri, Issam; Lahlali, Rachid; Fokar, Mohamed; Mentag, Rachid","Complete mitochondrial genome and phylogeny of the causal agent of Bayoud disease on date palm, Fusarium oxysporum f. sp. albedinis","Mitochondrial DNA Part B","","2380-2359","10.1080/23802359.2021.1978894","https://www.tandfonline.com/doi/full/10.1080/23802359.2021.1978894","","2021-10-03","2021-09-27 10:13:13","2021-09-27 10:13:29","2021-09-27 10:13:13","3059-3061","","10","6","","Mitochondrial DNA Part B","","","","","","","","en","","","","","DOI.org (Crossref)","","","","","","","","","","","","","","","","","","","","","","","","","","","","","","","","","","","","","","","","","","","","","","","","","","","","",""
"6BIRNJKZ","journalArticle","2020","Gou, Xiangjian; Shi, Haoran; Yu, Shifan; Wang, Zhiqiang; Li, Caixia; Liu, Shihang; Ma, Jian; Chen, Guangdeng; Liu, Tao; Liu, Yaxi","SSRMMD: A Rapid and Accurate Algorithm for Mining SSR Feature Loci and Candidate Polymorphic SSRs Based on Assembled Sequences","Frontiers in Genetics","","1664-8021","10.3389/fgene.2020.00706","https://www.frontiersin.org/article/10.3389/fgene.2020.00706/full","","2020-07-27","2021-10-26 10:05:43","2021-10-26 10:05:43","2021-10-26 10:05:43","706","","","11","","Front. Genet.","SSRMMD","","","","","","","","","","","","DOI.org (Crossref)","","","","C:\Users\workstation_bioinfo\Zotero\storage\ZBJKX5XP\Gou et al. - 2020 - SSRMMD A Rapid and Accurate Algorithm for Mining .pdf","","","","","","","","","","","","","","","","","","","","","","","","","","","","","","","","","","","","","","","","","","","","","","","","",""
"56DXS9N4","journalArticle","2021","Semmate, Noha; Boumart, Zineb; Bamouh, Zahra; Khayi, Slimane; Omari Tadlaoui, Khalid; Fellahi, Siham; El Harrak, Mehdi","Draft Genome Sequence of Pasteurella multocida Serotype A Strain MOR19, Isolated in Morocco","Microbiology Resource Announcements","","2576-098X","10.1128/MRA.00867-21","https://journals.asm.org/doi/10.1128/MRA.00867-21","Pasteurella multocida               causes pneumonia in large ruminants. In this study, we determined the genome sequence of the capsular serotype A               Pasteurella multocida               strain MOR19, isolated from a calf that died from acute pneumonia.                        ,              ABSTRACT                            Pasteurella multocida               causes pneumonia in large ruminants. In this study, we determined the genome sequence of the capsular serotype A               Pasteurella multocida               strain MOR19, isolated from a calf that died from acute pneumonia.","2021-10-14","2021-11-24 12:59:49","2021-11-24 12:59:49","2021-11-24 12:59:49","e00867-21","","41","10","","Microbiol Resour Announc","","","","","","","","en","","","","","DOI.org (Crossref)","","","","C:\Users\workstation_bioinfo\Zotero\storage\6REX3YFU\Semmate et al. - 2021 - Draft Genome Sequence of Pasteurella multocida Ser.pdf","","","","Dunning Hotopp, Julie C.","","","","","","","","","","","","","","","","","","","","","","","","","","","","","","","","","","","","","","","","","","","","",""
"HRZZCRTM","journalArticle","2021","Zelmat, Lamyaa; Mansi, Joseph Mbasani; Aouzal, Sarra; Gaboun, Fatima; Khayi, Slimane; Ibriz, Mohammed; El Guilli, Mohammed; Mentag, Rachid","Genetic Diversity and Population Structure of Moroccan Isolates Belong to Alternaria spp. Causing Black Rot and Brown Spot in Citrus","International Journal of Genomics","","2314-4378, 2314-436X","10.1155/2021/9976969","https://www.hindawi.com/journals/ijg/2021/9976969/","Alternaria alternata is one of the most important fungi causing various diseases on citrus worldwide. In Morocco, Alternaria black rot (ABR) and Alternaria brown spot (ABS) are two major diseases causing serious losses in commercial cultivars of citrus. The aim of the present work was to study the genetic diversity and the population structure of isolates belonging to sect. Alternaria obtained from infected citrus fruits, collected from seven provinces at different locations in Morocco (markets, packinghouses, and orchards). Forty-five isolates were analyzed by sequence-related amplified polymorphism (SRAP) markers, and cluster analysis of DNA fragments was performed using UPGMA method and Jaccard coefficient. Cluster analysis revealed that isolates were classified in four distinct groups. AMOVA revealed also a large extent of variation within sect. Alternaria isolates (99%). The results demonstrate that no correlation was found among SRAP pattern, host, and geographical origin of these isolates. Population structure analyses showed that the Alternaria isolates from the same collection origin had almost a similar level of admixture.","2021-11-23","2021-11-24 13:14:11","2021-11-24 13:14:11","2021-11-24 13:14:11","1-11","","","2021","","International Journal of Genomics","","","","","","","","en","","","","","DOI.org (Crossref)","","","","","","","","Ferrante, Antonio","","","","","","","","","","","","","","","","","","","","","","","","","","","","","","","","","","","","","","","","","","","","",""